{
  "$schema": "https://json-schema.org/draft/2020-12/schema",
  "$id": "smarthive/contracts/health.schema.json",
  "title": "Health",
  "description": "Node health snapshot every 60 s (node to server)",
  "type": "object",
  "properties": {
    "schema": {
      "type": "string",
      "pattern": "^smarthive\\.health/1\\.[0-9]+$"
    },
    "msg_id": {
      "type": "string",
      "pattern": "^[0-9a-f]{8}-[0-9a-f]{4}-[0-9a-f]{4}-[0-9a-f]{4}-[0-9a-f]{12}$"
    },
    "node_id": {
      "type": "string",
      "minLength": 1
    },
    "boot_id": {
      "type": "string",
      "pattern": "^[0-9a-f]{8}-[0-9a-f]{4}-[0-9a-f]{4}-[0-9a-f]{4}-[0-9a-f]{12}$"
    },
    "sent_at": {
      "type": "string",
      "pattern": "^\\d{4}-\\d{2}-\\d{2}T\\d{2}:\\d{2}:\\d{2}(\\.\\d+)?Z$"
    },
    "uptime_s": {
      "type": "integer",
      "minimum": 0
    },
    "soc_temp_c": {
      "type": "number"
    },
    "throttled": {
      "type": "object"
    },
    "cpu_load": {
      "type": "number",
      "minimum": 0
    },
    "mem_used_mb": {
      "type": "integer",
      "minimum": 0
    },
    "disk_free_mb": {
      "type": "integer",
      "minimum": 0
    },
    "outbox_pending": {
      "type": "integer",
      "minimum": 0
    },
    "images_pending": {
      "type": "integer",
      "minimum": 0
    },
    "dropped_total": {
      "type": "integer",
      "minimum": 0
    },
    "clock_synced": {
      "type": "boolean"
    },
    "ntp_offset_ms": {
      "type": "number"
    },
    "battery_v": {
      "type": "number"
    },
    "battery_ma": {
      "type": "number"
    },
    "versions": {
      "type": "object",
      "additionalProperties": {
        "type": "string"
      }
    },
    "config_version": {
      "type": "integer",
      "minimum": 0
    }
  },
  "required": [
    "schema",
    "msg_id",
    "node_id",
    "boot_id",
    "sent_at",
    "uptime_s",
    "outbox_pending",
    "clock_synced"
  ]
}
