{
  "schema": "smarthive.health/1.0",
  "msg_id": "0190f5a2-7c1e-7d43-9a1b-2f6c8e0d4b06",
  "node_id": "node-0001",
  "boot_id": "6c1f0b0e-3a52-4d0b-9f4c-1a2b3c4d5e6f",
  "sent_at": "2026-10-06T14:05:00.000Z",
  "uptime_s": 86400,
  "soc_temp_c": 52.1,
  "cpu_load": 0.4,
  "mem_used_mb": 310,
  "disk_free_mb": 24000,
  "outbox_pending": 0,
  "images_pending": 0,
  "dropped_total": 0,
  "clock_synced": true,
  "ntp_offset_ms": 3.2,
  "versions": {
    "agentd": "0.1.0"
  },
  "config_version": 7
}
