{
  "schema": "smarthive.health/1.0",
  "msg_id": "0190f5a5-3d4e-7f60-a172-c3d4e5f60718",
  "node_id": "node-0001",
  "boot_id": "6c1f0b0e-3a52-4d0b-9f4c-1a2b3c4d5e6f",
  "sent_at": "2026-10-06T14:05:00.000Z",
  "uptime_s": 8772,
  "soc_temp_c": 52.1,
  "throttled": {"under_voltage_now": false, "under_voltage_since_boot": false},
  "cpu_load": 0.42,
  "mem_used_mb": 310,
  "disk_free_mb": 24100,
  "outbox_pending": 0,
  "images_pending": 0,
  "dropped_total": 0,
  "clock_synced": true,
  "ntp_offset_ms": 3.1,
  "config_version": 7,
  "versions": {"software": "0.1.0", "stage1": "yolo26n-320@0.5"}
}
